{
  "$schema": "./schema.json",
  "id": "ecuador",
  "name": {
    "en": "Ecuador",
    "fr": "Équateur"
  },
  "description": {
    "en": "Ecuador with Galápagos Islands",
    "fr": "Équateur avec les îles Galápagos"
  },
  "category": "country",
  "dataSources": {
    "territories": "ecuador-territories-50m.json",
    "metadata": "ecuador-metadata-50m.json"
  },
  "metadata": {
    "naturalEarthIds": [
      218
    ],
    "iso3": "ECU",
    "region": "South America"
  },
  "territories": [
    {
      "id": "218",
      "role": "primary",
      "code": "EC-MAIN",
      "name": "Ecuador Mainland",
      "iso": "ECU",
      "center": [
        -78.5,
        -1.5
      ],
      "bounds": [
        [
          -81.08,
          -5.01
        ],
        [
          -75.19,
          1.68
        ]
      ],
      "extraction": {
        "mainlandPolygon": 0
      },
      "rendering": {
        "offset": [
          0,
          0
        ],
        "projectionType": "mercator"
      }
    },
    {
      "id": "218-galapagos",
      "role": "secondary",
      "code": "EC-GAL",
      "name": "Galápagos Islands",
      "iso": "ECU",
      "region": "Galápagos",
      "center": [
        -90.73,
        -1
      ],
      "bounds": [
        [
          -91.81,
          -1.4
        ],
        [
          -89.14,
          0.74
        ]
      ],
      "extraction": {
        "extractFrom": "218",
        "polygonIndices": [
          3,
          4,
          5,
          6,
          7,
          8
        ]
      },
      "rendering": {
        "offset": [
          -400,
          100
        ],
        "baseScaleMultiplier": 1.5
      }
    }
  ],
  "defaultPreset": "ecuador-default",
  "availablePresets": [
    "ecuador-default"
  ]
}
