{
  "$schema": "./schema.json",
  "id": "netherlands",
  "name": {
    "en": "Netherlands",
    "fr": "Pays-Bas"
  },
  "description": {
    "en": "Netherlands with Caribbean territories",
    "fr": "Pays-Bas avec territoires caribéens"
  },
  "category": "country",
  "dataSources": {
    "territories": "netherlands-territories-50m.json",
    "metadata": "netherlands-metadata-50m.json"
  },
  "metadata": {
    "naturalEarthIds": [
      528
    ],
    "iso3": "NLD",
    "region": "Europe"
  },
  "territories": [
    {
      "id": "528",
      "role": "primary",
      "code": "NL-NLD",
      "name": "Netherlands",
      "iso": "NLD",
      "center": [
        5.5,
        52.2
      ],
      "bounds": [
        [
          3.36,
          50.75
        ],
        [
          7.23,
          53.56
        ]
      ],
      "extraction": {
        "mainlandPolygon": 0
      },
      "rendering": {
        "offset": [
          0,
          0
        ],
        "projectionType": "conic-conformal"
      }
    },
    {
      "id": "528-bonaire",
      "role": "secondary",
      "code": "NL-BQ1",
      "name": "Bonaire",
      "iso": "NLD",
      "region": "Caribbean Netherlands",
      "center": [
        -68.25,
        12.2
      ],
      "bounds": [
        [
          -68.42,
          12.02
        ],
        [
          -68.19,
          12.31
        ]
      ],
      "extraction": {
        "extractFrom": "528",
        "polygonIndices": [
          9
        ]
      },
      "rendering": {
        "offset": [
          -250,
          -100
        ],
        "baseScaleMultiplier": 3
      }
    },
    {
      "id": "528-saba-sint-eustatius",
      "role": "secondary",
      "code": "NL-BQ2",
      "name": "Saba and Sint Eustatius",
      "iso": "NLD",
      "region": "Caribbean Netherlands",
      "center": [
        -63.1,
        17.5
      ],
      "bounds": [
        [
          -63.28,
          17.47
        ],
        [
          -62.97,
          17.64
        ]
      ],
      "extraction": {
        "extractFrom": "528",
        "polygonIndices": [
          10,
          11
        ]
      },
      "rendering": {
        "offset": [
          -250,
          -200
        ],
        "baseScaleMultiplier": 8
      }
    }
  ],
  "defaultPreset": "netherlands-default",
  "availablePresets": [
    "netherlands-default"
  ]
}
