{
  "$schema": "./schema.json",
  "id": "equatorial-guinea",
  "name": {
    "en": "Equatorial Guinea",
    "fr": "Guinée équatoriale"
  },
  "description": {
    "en": "Equatorial Guinea (Mainland and Islands)",
    "fr": "Guinée équatoriale (Continent et Îles)"
  },
  "category": "country",
  "dataSources": {
    "territories": "equatorial-guinea-territories-50m.json",
    "metadata": "equatorial-guinea-metadata-50m.json"
  },
  "metadata": {
    "naturalEarthIds": [
      226
    ],
    "iso3": "GNQ",
    "region": "Central Africa"
  },
  "territories": [
    {
      "id": "226",
      "role": "primary",
      "code": "GQ-MAIN",
      "name": "Río Muni (Continental)",
      "iso": "GNQ",
      "center": [
        10.5,
        1.6
      ],
      "bounds": [
        [
          9.34,
          0.92
        ],
        [
          11.35,
          2.35
        ]
      ],
      "extraction": {
        "extractFrom": "226",
        "polygonIndices": [
          1
        ]
      },
      "rendering": {
        "offset": [
          0,
          0
        ],
        "projectionType": "mercator"
      }
    },
    {
      "id": "226-bioko",
      "role": "secondary",
      "code": "GQ-BIO",
      "name": "Bioko",
      "iso": "GNQ",
      "region": "Bioko",
      "center": [
        8.7,
        3.5
      ],
      "bounds": [
        [
          8.42,
          3.2
        ],
        [
          8.98,
          3.77
        ]
      ],
      "extraction": {
        "extractFrom": "226",
        "polygonIndices": [
          0
        ]
      },
      "rendering": {
        "offset": [
          -200,
          -150
        ],
        "baseScaleMultiplier": 1.5
      }
    }
  ],
  "defaultPreset": "equatorial-guinea-default",
  "availablePresets": [
    "equatorial-guinea-default"
  ]
}
