{
  "$schema": "./atlas-schema.json",
  "id": "portugal",
  "name": "Portugal",
  "description": "Portugal, Madeira, and Azores",
  "category": "country",
  "dataSources": {
    "territories": "portugal-territories-50m.json",
    "metadata": "portugal-metadata-50m.json"
  },
  "defaultPreset": "portugal-default",
  "availablePresets": [
    "portugal-default"
  ],
  "metadata": {
    "naturalEarthIds": [
      620
    ],
    "iso3": "PRT",
    "region": "Europe"
  },
  "territories": [
    {
      "id": "620",
      "code": "PT-CONT",
      "name": "Portugal Continental",
      "role": "primary",
      "iso": "PRT",
      "bounds": [
        [
          -9.5,
          37
        ],
        [
          -6.2,
          42.2
        ]
      ],
      "center": [
        -8,
        39.5
      ],
      "extraction": {
        "mainlandPolygon": 1
      }
    },
    {
      "id": "620-20",
      "code": "PT-20",
      "name": "Madeira",
      "role": "secondary",
      "iso": "PRT",
      "region": "Atlantic",
      "bounds": [
        [
          -17.5,
          32.5
        ],
        [
          -16.5,
          33
        ]
      ],
      "center": [
        -16.9,
        32.75
      ],
      "extraction": {
        "extractFrom": "620",
        "polygonIndices": [
          0
        ]
      }
    },
    {
      "id": "620-30",
      "code": "PT-30",
      "name": "Azores",
      "role": "secondary",
      "iso": "PRT",
      "region": "Atlantic",
      "bounds": [
        [
          -32,
          36.5
        ],
        [
          -24.5,
          40
        ]
      ],
      "center": [
        -28,
        38.5
      ],
      "extraction": {
        "extractFrom": "620",
        "polygonIndices": [
          2,
          3,
          4,
          5,
          6,
          7,
          8
        ]
      }
    }
  ],
  "modes": [
    {
      "id": "mainland-only",
      "label": {
        "en": "Continental Portugal only",
        "fr": "Portugal continental uniquement"
      },
      "territories": [
        "PT-CONT"
      ]
    },
    {
      "id": "with-madeira",
      "label": {
        "en": "Continental + Madeira",
        "fr": "Continental + Madère"
      },
      "territories": [
        "PT-CONT",
        "PT-20"
      ]
    },
    {
      "id": "all-territories",
      "label": {
        "en": "All autonomous regions",
        "fr": "Toutes les régions autonomes"
      },
      "territories": [
        "PT-CONT",
        "PT-20",
        "PT-30"
      ]
    }
  ],
  "groups": [
    {
      "id": "mainland",
      "label": {
        "en": "Continental Portugal",
        "fr": "Portugal continental"
      },
      "territories": [
        "PT-CONT"
      ]
    },
    {
      "id": "atlantic",
      "label": {
        "en": "Atlantic autonomous regions",
        "fr": "Régions autonomes atlantique"
      },
      "territories": [
        "PT-20",
        "PT-30"
      ]
    }
  ]
}
